{
  "primary_profile": "business_growth_profile",
  "secondary_profile": "office_power_profile",
  "resource_axis": [
    "관정 권리와 급수표 운영권",
    "태양광 펌프, 배관, 창고, 냉장 설비 같은 agri-infra 자산",
    "육묘장과 모종 배분권",
    "계약재배 묶음과 등급별 수매표",
    "시장 자리, 우회 운송망, 냉장차, 기사 네트워크",
    "허가, 세금, 토지등록, 우물 조례, 학교 급식 계약 같은 행정 레버",
    "실업 상태 대졸자·귀국 디아스포라·시청 실무자 인재 풀",
    "개발금융, 지역은행, 항만 시험선, 국가 조달·특구 접점"
  ],
  "power_axis": [
    "물·치안·운송·허가·시장 자리의 병목을 한 장 시스템으로 읽는 능력",
    "죽은 자산을 working asset으로 바꾸는 현장 설계력",
    "남는 물과 못난이 작물을 정보망과 보호망으로 환전하는 생활권 운영 감각",
    "급수표, 수매표, 장부, 조례로 질서를 제도화하는 능력",
    "현지 엘리트와 행정 인재를 고용이 아니라 시스템으로 묶는 조직화 능력",
    "기업형 범죄 네트워크와 총격이 아니라 사업·장부·허가 전쟁으로 맞붙는 힘"
  ],
  "control_axis": [
    "도윤이 급수표를 짜지 않으면 루곤도의 물 분쟁과 생활 불안정이 다시 즉흥 폭력으로 회귀하는 상태",
    "도윤이 수매표를 공개하지 않으면 소농들이 마칼리의 그림자세와 저가 매입 구조로 다시 빨려 들어가는 상태",
    "도윤이 냉장·운송·시장 자리를 한 줄로 묶지 못하면 첫 수확이 반복 현금흐름으로 연결되지 않는 상태",
    "도윤이 인재 풀과 시청 실무 라인을 묶지 않으면 허가, 세금, 토지등록, 조례가 계속 거래형 압박 수단으로 남는 상태",
    "국가와 도시가 급할 때 도윤 시스템을 먼저 찾지 않으면 식량, 물가, 지방안정 의제가 매번 임시방편으로만 돌아가는 상태"
  ],
  "payoff_axis": [
    "30일 비개입 유예와 첫 장비 반입 안전구역",
    "첫 물과 첫 working farm proof",
    "시장 바닥 정보망과 아미나의 신뢰",
    "첫 제도권 납품과 첫 현금 회수",
    "첫 소농 계약재배 묶음과 수매표 표준화",
    "냉장·운송·시장 운영권과 도시 물가 안정 카드",
    "우물 조례, 학교 급식, 허가 패스트트랙, 시청 장부 영향력",
    "권역 수매망, 국가 비상공급 파트너, 농업특구 실권, 국가 킹메이커"
  ],
  "failure_axis": [
    "돈 없는 외국인 프레임에 갇혀 장비 반입과 허가에서 질식하는 상태",
    "마칼리의 보호비, 야간 절도, 기사 빼가기, 연료 장난에 반복적으로 휘둘리는 상태",
    "물은 살렸지만 제도권 납품과 시장 자리를 못 붙여 현금흐름으로 못 넘어가는 상태",
    "수매표와 급수표가 사람을 못 모아 도윤 시스템이 개인 선행처럼 축소되는 상태",
    "도윤이 군 경력을 과잉 사용해 전투영웅물로 오염되는 상태",
    "현지 인재 풀을 못 만들고 도윤 혼자만 돌아가 시스템이 부재 시 바로 붕괴하는 상태",
    "도시 운영을 설교나 감동으로 처리해 제도화가 안 보이는 상태",
    "주지사·중앙정부·개발금융 확장에서 scale이 receipts를 앞질러 개연성이 무너지는 상태"
  ],
  "hud_interpretation": {
    "capital": "이 작품의 capital은 단순 현금이 아니라 관정 권리, 급수표, 수매표, 냉장창고, 운송 기사, 허가 패스트트랙, 인재 풀, 시청 실무 라인, 특구·조달 접점까지 포함한 통제 가능한 생활 인프라 자산 전체다",
    "deal_type": "관정 복구, 장비 반입, 긴급 납품, 계약재배 체결, 수매표 공개, 우물 조례 통과, 학교 급식 계약, 권역 수매망 설계, 개발금융 유치, 항만 시험선 확보 같은 관문 단위 액션으로 읽는다",
    "resource_power_hud": "물, 냉장, 운송, 시장 자리, 허가, 장부, 경찰 협력, 인재 풀, 금융·항만 접점이 어느 수준까지 도윤 손에 들어왔는지를 함께 보여주는 agri-infra + office-power HUD로 해석한다",
    "business_lines": "은딜라 농장, 루곤도 중앙시장, 병원·호텔·UN/NGO 컴파운드 구매 라인, 계약재배 소농망, 냉장·운송 라인, 시청 허가/조달, 개발금융·은행, 바라카 항만·수출선",
    "company_state": "루곤도와 은딜라 평원의 현재 운영 상태 — 물 분쟁, 시장 자리, 수매 가격, 냉장 손실률, 허가·세금 마찰, 시청 실무 역량, 마칼리의 그림자세, 도시 물가 안정 여부"
  }
}
